,StoryHeadlines,Story_in_Detail,Category
35,He held up a smiley-face sign in public. Singapore charged him with unlawful assembly,,Singapore News
36,World stocks wobble after Mnuchin pulls plug on Fed stimulus,,Singapore News
37,‘She has to finally come to a decision’: GSA chief Emily Murphy faces blowback as nation awaits vote certification,,Singapore News
38,Man who allowed 15-year-old girls to smoke meth jailed,,Singapore News
39,Man charged for defacing Mother Mary statue wanted to 'beautify' her,,Singapore News
40,Warning Signs of COPD (Chronic Obstructive Pulmonary Disease),,Singapore News
41,Critics roast Rudy Giuliani for apparent hair dye mishap: 'Hire union hair and makeup professionals',,Singapore News
42,COVID-19: Singapore confirms 4 new cases; no local case for 10th straight day,,Singapore News
43,Superspreader events key driver in Covid-19 pandemic,,Singapore News
44,"Georgia recount confirms Biden victory over Trump, says state election official",,Singapore News
45,Black Friday: Amazon Singapore is having a major sale on these Apple AirPods,,Singapore News
46,Campus march by Hong Kong graduates marks a year since university clashes,,Singapore News
47,'Blood on your hands': Polish ruling party boss slams opposition amid protests,,Singapore News
48,"Marina Bay Sands celebrates its 10th anniversary with light shows, shopping celebrations",,Singapore News
49,Trump's vaccine team will not brief Biden administration - U.S senators,,Singapore News
50,Some Russian hospitals face shortages of COVID-19 drugs,,Singapore News
51,Top 3 Mistakes To Avoid When Purchasing a Second-Hand Car,,Singapore News
52,Opposites attract: Wild and captive jaguars mate in Argentina to save species,,Singapore News
53,Trump news – live: Georgia count confirms Biden victory as Giuliani dye-leaking speech branded ‘dangerous’,,Singapore News
54,Over 900 Midwest Mayo Clinic Staff Diagnosed With Coronavirus In Last 2 Weeks,,Singapore News
55,Hong Kong mask manufacturer suspends business after being accused of possibly violating national security law over design and packaging of products,,Singapore News
56,Singapore minister doesn’t see more virus aid before Budget,,Singapore News
57,Alex Jones Leads Protesters Into Georgia State Capital as Recount Continues,,Singapore News
58,Mizuho to cut Singapore office space on work-from-home success,,Singapore News
59,Taxi to nowhere: virus measures hit London black cab business,,Singapore News
60,The story behind Princess Diana's controversial but enduringly popular sapphire engagement ring,,Singapore News
61,FOOD REVIEW: “I sit at The Halia and wondered if indeed bigger is better”,,Singapore News
62,"Taiwan says Trump cabinet member to visit, angering China",,Singapore News
63,Covid: Pizza worker's 'lie' forced South Australia lockdown,,Singapore News
64,How Much Can You Borrow For Your Home Loan?,,Singapore News
65,"Black Friday 2020: Early fashion deals from Alo Yoga, Asos and more",,Singapore News
66,"German vaccine maker gives hope as US virus deaths top 250,000",,Singapore News
